<?xml version="1.0" encoding="ISO-8859-1"?>
<shiporder orderid="889923"
xmlns:xsi="http://www.w3.org/2001/XMLSchema"
xsi:noNamespaceSchemaLocation="personSchema.xsd">
 <orderperson>George Bush</orderperson>
 <item>
  <title>Empire Burlesque</title>
  <note>Special Edition</note>
  <quantity>1</quantity>
  <price>10.90</price>
 </item>
 <item>
  <title>Hide your heart</title>
  <quantity>1</quantity>
  <price>9.90</price>
 </item>
</shiporder>